{"blueprint_id":"campaign-performance-brief-blueprint","course_id":"campaign-performance-brief","criteria":[{"assessment_evidence":"提交保留曝光與點擊分母來源的 CTR 欄位。","capability_id":"cap-calculate-ctr","g0_criterion_id":"all-metrics","id":"g2-ctr","outcome_id":"outcome-metrics","statement":"三個活動的 CTR 數值與百分比單位正確。"},{"assessment_evidence":"提交保留花費與點擊分母來源的平均 CPC 欄位。","capability_id":"cap-calculate-cpc","g0_criterion_id":"all-metrics","id":"g2-cpc","outcome_id":"outcome-metrics","statement":"三個活動的平均 CPC 數值與金額單位正確。"},{"assessment_evidence":"提交保留轉換與點擊分母來源的 CVR 欄位。","capability_id":"cap-calculate-cvr","g0_criterion_id":"all-metrics","id":"g2-cvr","outcome_id":"outcome-metrics","statement":"三個活動的 CVR 數值與百分比單位正確。"},{"assessment_evidence":"提交保留花費與轉換分母來源的 CPA 欄位。","capability_id":"cap-calculate-cpa","g0_criterion_id":"all-metrics","id":"g2-cpa","outcome_id":"outcome-metrics","statement":"三個活動的 CPA 數值與金額單位正確。"},{"assessment_evidence":"提交保留轉換價值與花費分母來源的 ROAS 欄位。","capability_id":"cap-calculate-roas","g0_criterion_id":"all-metrics","id":"g2-roas","outcome_id":"outcome-metrics","statement":"三個活動的 ROAS 數值與比率單位正確。"},{"assessment_evidence":"完成品指出 Prospecting Social 的 CPA 與 ROAS 均未達標。","capability_id":"cap-correct-threshold","g0_criterion_id":"correct-threshold","id":"g2-correct-threshold","outcome_id":"outcome-threshold","statement":"依 CPA 不高於 NT$500 且 ROAS 不低於 4.00 的共同條件正確判讀。"},{"assessment_evidence":"完成品明示彙總資料不能單獨證明因果。","capability_id":"cap-evidence-boundary","g0_criterion_id":"evidence-boundary","id":"g2-evidence-boundary","outcome_id":"outcome-brief","statement":"摘要把可觀察結果與尚未驗證的成因清楚分開。"},{"assessment_evidence":"完成品包含具體測試動作、比較條件與後續觀察指標。","capability_id":"cap-actionable-next-step","g0_criterion_id":"actionable-next-step","id":"g2-actionable-next-step","outcome_id":"outcome-brief","statement":"摘要提出一項可執行測試及對應觀察指標。"}],"decision_narrative":{"constraint_fit":"三個實作單元共三十七分鐘，另有四分鐘休息與四分鐘修正緩衝，能在 G0 的四十五分鐘內完成真實交付物。","g1_evidence_refs":["g1-research"],"rationale":"G1 的指標定義與平台歸因證據顯示，學員必須先穩定處理分母與單位，再把描述性資料轉成不越界的決策文字。","recommended_path":"先用固定資料建立可重算指標，再套用一致門檻，最後寫成有證據界線與可觀察下一步的摘要。"},"duration":{"available_minutes":45,"break_minutes":4,"buffer_minutes":4,"policy":"第二單元後休息四分鐘；緩衝只用於修正公式或文字，不刪除獨立練習與驗收。"},"final_acceptance":{"criteria_ids":["all-metrics","correct-threshold","evidence-boundary","actionable-next-step"],"outcome_id":"campaign-performance-brief"},"materials":["固定活動資料 CSV、成效摘要 Markdown 範本、learner-visible rubric 與三個單元的完整示範。"],"outcomes":[{"criterion_ids":["g2-ctr","g2-cpc","g2-cvr","g2-cpa","g2-roas"],"id":"outcome-metrics","statement":"學員能從固定原始欄位完成五項可重算指標。"},{"criterion_ids":["g2-correct-threshold"],"id":"outcome-threshold","statement":"學員能以 CPA 與 ROAS 的共同門檻判斷活動表現。"},{"criterion_ids":["g2-evidence-boundary","g2-actionable-next-step"],"id":"outcome-brief","statement":"學員能寫出區分事實、限制與可驗證下一步的成效摘要。"}],"requirements_id":"campaign-performance-brief-requirements","risks":[{"description":"學員可能選錯分母，或把彙總指標寫成未經驗證的因果結論。","id":"risk-formula-and-inference","mitigation":"每單元提供預期結果、分母檢查、推論界線與可重做的恢復步驟。","owner_gate":"G3"}],"schema_version":1,"units":[{"assessment_evidence":[{"criterion_id":"g2-ctr","evidence":"保存獨立完成的階段成果及逐項檢核結果。"},{"criterion_id":"g2-cpc","evidence":"保存獨立完成的階段成果及逐項檢核結果。"}],"asset_ids":["campaign-data","brief-template","rubric"],"capability_ids":["cap-calculate-ctr","cap-calculate-cpc"],"context":"學員正在準備每週例會，需要把上一階段的可重算結果轉成主管能採用的下一階段成果。","criterion_ids":["g2-ctr","g2-cpc"],"depends_on":[],"duration_minutes":12,"g1_evidence_refs":["g1-research"],"guided_practice":{"activity":"學員改用第二個活動跟做，並在公式或判讀轉折處停下核對。","check":"學員能指出自己的結果是否符合該單元 criterion，並說明差異來源。","feedback":"教材提供預期數值或判讀，讓學員定位欄位、分母、門檻或推論錯誤。","recovery":"回到原始欄位與門檻逐項重算或改寫，直到可由另一位讀者重現。"},"id":"unit-1","independent_practice":{"changed_conditions":["改用尚未示範的活動資料","拿掉逐步代入答案並要求保留判斷依據"],"check":"依穩定 criterion ID 逐項核對獨立成果，且保留可重新驗證的數字或文字。","decision":"學員自行選擇適用公式或判讀方式，並決定如何在完成品中呈現。","deliverable":"完成三個活動的 CTR 與平均 CPC 計算表。","recovery":"未通過時先定位資料、公式、門檻或推論界線，再只重做受影響部分並重新核對。"},"materials":["campaign-data.csv、brief-template.md、rubric.md 與該單元完整示範。"],"outcome":"完成三個活動的 CTR 與平均 CPC 計算表。","outcome_ids":["outcome-metrics"],"output":"完成三個活動的 CTR 與平均 CPC 計算表。","prerequisite_unit_ids":[],"risk":{"asset_dependency":3,"downstream_dependency":5,"failure_cost":2,"layout_complexity":2,"tool_uncertainty":1},"teaching_approach":"先說明這一步支持的工作判斷，再完整示範輸入、選擇理由、操作、結果與驗證，接著讓學員跟做及獨立完成。","title":"從原始欄位建立效率指標","worked_example_plan":{"actions":["代入實際數字完成該單元工作，保留中間依據，並依預期結果逐項核對。"],"input":"使用課程 CSV 中一個活動的實際曝光、點擊、花費、轉換與價值資料。","rationale":"每一步都說明公式分母或判斷門檻如何影響主管會採取的行動。","result":"完成三個活動的 CTR 與平均 CPC 計算表。","verification":"使用單元的 criterion-level 檢核，確認數值、單位、推論界線與可觀察結果。"},"workflow_fingerprint":"calculate-engagement-efficiency"},{"assessment_evidence":[{"criterion_id":"g2-cvr","evidence":"保存獨立完成的階段成果及逐項檢核結果。"},{"criterion_id":"g2-cpa","evidence":"保存獨立完成的階段成果及逐項檢核結果。"},{"criterion_id":"g2-roas","evidence":"保存獨立完成的階段成果及逐項檢核結果。"},{"criterion_id":"g2-correct-threshold","evidence":"保存獨立完成的階段成果及逐項檢核結果。"}],"asset_ids":["campaign-data","brief-template","rubric"],"capability_ids":["cap-calculate-cvr","cap-calculate-cpa","cap-calculate-roas","cap-correct-threshold"],"context":"學員正在準備每週例會，需要把上一階段的可重算結果轉成主管能採用的下一階段成果。","criterion_ids":["g2-cvr","g2-cpa","g2-roas","g2-correct-threshold"],"depends_on":["unit-1"],"duration_minutes":12,"g1_evidence_refs":["g1-research"],"guided_practice":{"activity":"學員改用第二個活動跟做，並在公式或判讀轉折處停下核對。","check":"學員能指出自己的結果是否符合該單元 criterion，並說明差異來源。","feedback":"教材提供預期數值或判讀，讓學員定位欄位、分母、門檻或推論錯誤。","recovery":"回到原始欄位與門檻逐項重算或改寫，直到可由另一位讀者重現。"},"id":"unit-2","independent_practice":{"changed_conditions":["改用尚未示範的活動資料","拿掉逐步代入答案並要求保留判斷依據"],"check":"依穩定 criterion ID 逐項核對獨立成果，且保留可重新驗證的數字或文字。","decision":"學員自行選擇適用公式或判讀方式，並決定如何在完成品中呈現。","deliverable":"補齊 CVR、CPA 與 ROAS，並正確判斷活動是否同時達到門檻。","recovery":"未通過時先定位資料、公式、門檻或推論界線，再只重做受影響部分並重新核對。"},"materials":["campaign-data.csv、brief-template.md、rubric.md 與該單元完整示範。"],"outcome":"補齊 CVR、CPA 與 ROAS，並正確判斷活動是否同時達到門檻。","outcome_ids":["outcome-metrics","outcome-threshold"],"output":"補齊 CVR、CPA 與 ROAS，並正確判斷活動是否同時達到門檻。","prerequisite_unit_ids":["unit-1"],"risk":{"asset_dependency":3,"downstream_dependency":5,"failure_cost":4,"layout_complexity":3,"tool_uncertainty":2},"teaching_approach":"先說明這一步支持的工作判斷，再完整示範輸入、選擇理由、操作、結果與驗證，接著讓學員跟做及獨立完成。","title":"補齊商業結果並套用門檻","worked_example_plan":{"actions":["代入實際數字完成該單元工作，保留中間依據，並依預期結果逐項核對。"],"input":"使用課程 CSV 中一個活動的實際曝光、點擊、花費、轉換與價值資料。","rationale":"每一步都說明公式分母或判斷門檻如何影響主管會採取的行動。","result":"補齊 CVR、CPA 與 ROAS，並正確判斷活動是否同時達到門檻。","verification":"使用單元的 criterion-level 檢核，確認數值、單位、推論界線與可觀察結果。"},"workflow_fingerprint":"calculate-and-compare-business-outcomes"},{"assessment_evidence":[{"criterion_id":"g2-evidence-boundary","evidence":"保存獨立完成的階段成果及逐項檢核結果。"},{"criterion_id":"g2-actionable-next-step","evidence":"保存獨立完成的階段成果及逐項檢核結果。"}],"asset_ids":["campaign-data","brief-template","rubric"],"capability_ids":["cap-evidence-boundary","cap-actionable-next-step"],"context":"學員正在準備每週例會，需要把上一階段的可重算結果轉成主管能採用的下一階段成果。","criterion_ids":["g2-evidence-boundary","g2-actionable-next-step"],"depends_on":["unit-2"],"duration_minutes":13,"g1_evidence_refs":["g1-research"],"guided_practice":{"activity":"學員改用第二個活動跟做，並在公式或判讀轉折處停下核對。","check":"學員能指出自己的結果是否符合該單元 criterion，並說明差異來源。","feedback":"教材提供預期數值或判讀，讓學員定位欄位、分母、門檻或推論錯誤。","recovery":"回到原始欄位與門檻逐項重算或改寫，直到可由另一位讀者重現。"},"id":"unit-3","independent_practice":{"changed_conditions":["改用尚未示範的活動資料","拿掉逐步代入答案並要求保留判斷依據"],"check":"依穩定 criterion ID 逐項核對獨立成果，且保留可重新驗證的數字或文字。","decision":"學員自行選擇適用公式或判讀方式，並決定如何在完成品中呈現。","deliverable":"完成可驗收的成效摘要，區分數據判讀、限制與下一步。","recovery":"未通過時先定位資料、公式、門檻或推論界線，再只重做受影響部分並重新核對。"},"materials":["campaign-data.csv、brief-template.md、rubric.md 與該單元完整示範。"],"outcome":"完成可驗收的成效摘要，區分數據判讀、限制與下一步。","outcome_ids":["outcome-brief"],"output":"完成可驗收的成效摘要，區分數據判讀、限制與下一步。","prerequisite_unit_ids":["unit-2"],"risk":{"asset_dependency":4,"downstream_dependency":5,"failure_cost":5,"layout_complexity":4,"tool_uncertainty":1},"teaching_approach":"先說明這一步支持的工作判斷，再完整示範輸入、選擇理由、操作、結果與驗證，接著讓學員跟做及獨立完成。","title":"把判讀寫成可交付摘要","worked_example_plan":{"actions":["代入實際數字完成該單元工作，保留中間依據，並依預期結果逐項核對。"],"input":"使用課程 CSV 中一個活動的實際曝光、點擊、花費、轉換與價值資料。","rationale":"每一步都說明公式分母或判斷門檻如何影響主管會採取的行動。","result":"完成可驗收的成效摘要，區分數據判讀、限制與下一步。","verification":"使用單元的 criterion-level 檢核，確認數值、單位、推論界線與可觀察結果。"},"workflow_fingerprint":"write-evidence-bounded-brief"}]}
